{
  "schema_version": "1.0.0",
  "corpus_id": "schema-contract-example",
  "corpus_version": "v1",
  "corpus_fingerprint": "corpus-sha256-26e672fd29558cf5f5708d3e800a58e42f46f855ff0f752bd0816781faaf828c",
  "created_at": "2026-08-16T00:00:00Z",
  "samples": [
    {
      "sample_id": "example-zh-command-001",
      "audio": {
        "path": "source/example-zh-command-001.wav",
        "sha256": "0000000000000000000000000000000000000000000000000000000000000000",
        "format": {
          "container": "wav",
          "codec": "pcm-s16le",
          "sample_rate_hz": 16000,
          "channels": 1,
          "sample_width_bits": 16
        },
        "duration_ms": 1000
      },
      "language": "zh-CN",
      "scenario": "short-command",
      "reference": {
        "text": "打开语音助手",
        "normalization_version": "text-normalization-v1",
        "normalized_text": "打开语音助手",
        "language_segments": [
          {
            "language": "zh",
            "original": "打开语音助手",
            "normalized": "打开语音助手",
            "start": 0,
            "end": 6
          }
        ]
      },
      "source": {
        "kind": "generated",
        "description": "Schema-only example; task 2.1 does not include this audio file.",
        "uri": null,
        "license": {
          "identifier": "project-generated-example",
          "name": "Project-generated schema example",
          "uri": null,
          "redistribution": "allowed",
          "evidence": "Illustrative metadata only; no audio is distributed by this example."
        }
      }
    },
    {
      "sample_id": "example-silence-001",
      "audio": {
        "path": "source/example-silence-001.wav",
        "sha256": "1111111111111111111111111111111111111111111111111111111111111111",
        "format": {
          "container": "wav",
          "codec": "pcm-s16le",
          "sample_rate_hz": 16000,
          "channels": 1,
          "sample_width_bits": 16
        },
        "duration_ms": 1000
      },
      "language": "none",
      "scenario": "silence",
      "reference": {
        "text": null,
        "normalization_version": null,
        "normalized_text": null,
        "language_segments": []
      },
      "source": {
        "kind": "generated",
        "description": "Schema-only example; task 2.1 does not include this audio file.",
        "uri": null,
        "license": {
          "identifier": "project-generated-example",
          "name": "Project-generated schema example",
          "uri": null,
          "redistribution": "allowed",
          "evidence": "Illustrative metadata only; no audio is distributed by this example."
        }
      }
    }
  ]
}
